{"props":{"pageProps":{"profile":{"isStatic":true,"ipoDate":"2001-06-18","currency":"USD","name":"Iron Mountain Incorporated","search":["i","ir","irm","iro","iron","iron ","iron m","iron mo","iron mou","iron moun","iron mount","iron mounta","iron mountai","iron mountain","iron mountain ","iron mountain i","iron mountain in","iron mountain inc","iron mountain inco","iron mountain incor","iron mountain incorp","iron mountain incorpo","iron mountain incorpor","iron mountain incorpora","iron mountain incorporat","iron mountain incorporate","iron mountain incorporated"],"industry":"REITâ€”Specialty","exchangeShort":"NYSE","symbol":"IRM","sector":"Real Estate","website":"https://www.ironmountain.com","description":"Iron Mountain Incorporated (NYSE: IRM), founded in 1951, is the global leader for storage and information management services. Trusted by more than 225,000 organizations around the world, and with a real estate network of more than 90 million square feet across approximately 1,450 facilities in approximately 50 countries, Iron Mountain stores and protects billions of valued assets, including critical business information, highly sensitive data, and cultural and historical artifacts. Providing solutions that include secure records storage, information management, digital transformation, secure destruction, as well as data centers, cloud services and art storage and logistics, Iron Mountain helps customers lower cost and risk, comply with regulations, recover from disaster, and enable a more digital way of working."}},"__N_SSG":true},"page":"/quote/[symbol]","query":{"symbol":"IRM"},"buildId":"Njk4sJo_1dBWR55wHuASm","isFallback":false,"gsp":true,"scriptLoader":[]}